<?xml version="1.0" encoding="UTF-8"?>
<xs:schema xmlns:xs="http://www.w3.org/2001/XMLSchema"
  xmlns="http://zchalmers.github.io/CSE445-Assignment4"
  targetNamespace="http://zchalmers.github.io/CSE445-Assignment4"
  elementFormDefault="qualified"
  attributeFormDefault="unqualified">

  <xs:element name="NationalParks">
    <xs:annotation>
      <xs:documentation>CSE445 Assignment 4 National Parks.</xs:documentation>
    </xs:annotation>
    <xs:complexType>
      <xs:sequence>
        <xs:element name="NationalPark" maxOccurs="unbounded">
          <xs:complexType>
            <xs:sequence>
              <xs:element name="Name" type="xs:string"/>
              <xs:element name="Phone" type="xs:string" minOccurs="1" maxOccurs="unbounded"/>
              <xs:element name="Address">
                <xs:complexType>
                  <xs:sequence>
                    <xs:element name="Number" type="xs:string"/>
                    <xs:element name="Street" type="xs:string"/>
                    <xs:element name="City" type="xs:string"/>
                    <xs:element name="State" type="xs:string"/>
                    <xs:element name="Zip" type="xs:string"/>
                  </xs:sequence>
                  <xs:attribute name="NearestAirport" type="xs:string" use="optional"/>
                </xs:complexType>
              </xs:element>
            </xs:sequence>
            <xs:attribute name="Region" type="xs:string" use="required"/>
            <xs:attribute name="Rating" type="xs:string" use="optional"/>
          </xs:complexType>
        </xs:element>
      </xs:sequence>
    </xs:complexType>
  </xs:element>

</xs:schema>
